{
  "schema_version": "1.0",
  "episode_id": "E002",
  "board_id": "B01",
  "rows": 2,
  "columns": 2,
  "outer_margin_px": 10,
  "gutter_px": 12,
  "cells": [
    {
      "slide_id": "S01",
      "row": 0,
      "column": 0,
      "intent": "casual handoff: stained jeans are left with a light machine-wash request"
    },
    {
      "slide_id": "S02",
      "row": 0,
      "column": 1,
      "intent": "boyfriend overthinks the simple request and researches denim care"
    },
    {
      "slide_id": "S03",
      "row": 1,
      "column": 0,
      "intent": "over-care becomes visible action through careful hand-washing"
    },
    {
      "slide_id": "S04",
      "row": 1,
      "column": 1,
      "intent": "girlfriend discovers the needless care and lands on affectionate amusement"
    }
  ]
}
