{
  "schema_version": "1.0",
  "episode_id": "E002",
  "board_id": "B01",
  "rows": 2,
  "columns": 2,
  "outer_margin_px": 0,
  "gutter_px": 20,
  "cells": [
    {
      "slide_id": "S01",
      "row": 0,
      "column": 0,
      "intent": "casual laundry request; stained dry jeans left with boyfriend"
    },
    {
      "slide_id": "S02",
      "row": 0,
      "column": 1,
      "intent": "boyfriend seriously researches denim washing while holding jeans and phone"
    },
    {
      "slide_id": "S03",
      "row": 1,
      "column": 0,
      "intent": "boyfriend carefully hand-washes the same jeans"
    },
    {
      "slide_id": "S04",
      "row": 1,
      "column": 1,
      "intent": "next visit; girlfriend receives clean dry folded jeans and realizes the extra care"
    }
  ]
}
