{
  "schema_version": "1.0",
  "episode_id": "E001",
  "board_id": "B01",
  "rows": 2,
  "columns": 2,
  "outer_margin_px": 10,
  "gutter_px": 12,
  "cells": [
    {"slide_id": "S01", "row": 0, "column": 0, "intent": "finally receives the grape drink after a long wait"},
    {"slide_id": "S02", "row": 0, "column": 1, "intent": "simple question makes her mind go blank"},
    {"slide_id": "S03", "row": 1, "column": 0, "intent": "Korean 지금 becomes an impromptu pronunciation lesson"},
    {"slide_id": "S04", "row": 1, "column": 1, "intent": "she escapes while still enjoying the drink"}
  ]
}
